{
  "$schema": "http://json-schema.org/draft-07/schema#",
  "$id": "https://the-sovereign/ttcl-specs/semiotic-program-schema.json",
  "title": "TTCL Semiotic Program — compiler L3 (SemioticDialect) input contract",
  "description": "A declarative TTCL program consumed by the @sovereign/compiler L3 SemioticDialect loader. Declares wheels, signs, and combinator ops; the compiler builds an SSA SignGraph, runs L2 passes (type/modality inference, constitution compliance, budgeted expansion), then the L1 Provenance pass (linear token threading, encodeSign/decodeSign lowering, KeyCap capability check) over the optional `provenance` section, and — on success — lowers to the @sovereign/ttcl runtime (L0) by instantiating Wheel/Sign objects. Validated at load time with ajv. The L2 combinator op set: compose (the TTCL JOIN), map / fold / choose (modality-preserving passthroughs in v1 — full branch-join semantics deferred). The L1 encoding ops (encodeSign / decodeSign) live in the optional `provenance.ops` array, NOT in `ops`. Sample programs: shared/fixtures/layer7/semiotic-program-{triadic,raw-technology}.json.",
  "type": "object",
  "required": ["program", "wheels", "signs", "ops", "budget", "output"],
  "additionalProperties": false,
  "properties": {
    "$schema": {
      "type": "string",
      "description": "Optional JSON Schema reference (the schema's own $id). Permitted but not required."
    },
    "program": {
      "type": "string",
      "minLength": 1,
      "description": "Program identifier."
    },
    "wheels": {
      "type": "array",
      "description": "Wheel declarations (Llull rotating wheels). The product of their sizes is checked against `budget` by the L2 budgeted-expansion pass via combineWheelsBudgeted.",
      "items": {
        "type": "object",
        "required": ["id", "size"],
        "additionalProperties": false,
        "properties": {
          "id": { "type": "string", "minLength": 1 },
          "size": { "type": "integer", "minimum": 1 },
          "initial": { "type": "integer", "minimum": 0, "default": 0 }
        }
      }
    },
    "signs": {
      "type": "array",
      "minItems": 1,
      "description": "Sign declarations. Each is materialized via makeSign (the manifold is the sole source of truth for the peirce block). `mode` is the CoarseMode (ICON/INDEX/SYMBOL); `modality` is the modal-lattice position (PURE/ICON/INDEX/SYMBOL/HYBRID).",
      "items": {
        "type": "object",
        "required": ["id", "class_id", "mode", "domain", "modality", "pps"],
        "additionalProperties": false,
        "properties": {
          "id": { "type": "string", "minLength": 1 },
          "class_id": { "type": "integer", "minimum": 0, "maximum": 65 },
          "mode": { "type": "string", "enum": ["ICON", "INDEX", "SYMBOL"] },
          "domain": { "type": "string", "enum": ["THEOLOGY", "TECHNOLOGY", "COSMOLOGY"] },
          "modality": { "type": "string", "enum": ["PURE", "ICON", "INDEX", "SYMBOL", "HYBRID"] },
          "pps": { "type": "number", "minimum": 0.0, "maximum": 1.0 },
          "domains": {
            "type": "array",
            "minItems": 1,
            "items": { "type": "string", "enum": ["THEOLOGY", "TECHNOLOGY", "COSMOLOGY"] },
            "description": "Triadic ancestry; defaults to [domain]."
          },
          "noRlhf": { "type": "boolean", "default": true },
          "trace": {
            "type": "object",
            "required": ["intentionId", "source"],
            "additionalProperties": false,
            "properties": {
              "intentionId": { "type": "string", "minLength": 1 },
              "source": { "type": "string", "minLength": 1 },
              "parentEventId": { "type": "string", "minLength": 1 },
              "constraintEnvelopeId": { "type": "string", "minLength": 1 },
              "narrativePurposeId": { "type": "string", "minLength": 1 },
              "createdAt": { "type": "string", "format": "date-time" }
            }
          }
        }
      }
    },
    "ops": {
      "type": "array",
      "description": "Combinator ops (the L2 SignGraphDialect). Each op references prior SSA nodes by id. `compose` is the TTCL JOIN (output HYBRID); `map`/`fold`/`choose` are modality-preserving passthroughs in v1.",
      "items": {
        "type": "object",
        "required": ["id", "op", "inputs"],
        "additionalProperties": false,
        "properties": {
          "id": { "type": "string", "minLength": 1 },
          "op": { "type": "string", "enum": ["compose", "map", "fold", "choose"] },
          "inputs": {
            "type": "array",
            "minItems": 1,
            "items": { "type": "string", "minLength": 1 },
            "description": "Referenced SSA node ids (signs or prior ops)."
          }
        }
      }
    },
    "constitution": {
      "type": "object",
      "additionalProperties": false,
      "properties": {
        "threshold": {
          "type": "number",
          "minimum": 0.0,
          "maximum": 1.0,
          "description": "Optional constitution pass threshold override; defaults to CONSTITUTION_PASS_THRESHOLD from the canonical numerics."
        }
      },
      "description": "Graph-level constitution declaration (the prose's L3 `defineConstitution` op, modeled as a graph field)."
    },
    "budget": {
      "type": "integer",
      "minimum": 1,
      "description": "Wheel state-space budget cap. The L2 budgeted-expansion pass throws WheelBudgetExceededError when ∏ wheel sizes > budget."
    },
    "output": {
      "type": "string",
      "minLength": 1,
      "description": "Terminal SSA node id (the program's output). Triadic closure is enforced on this node's inferred domains."
    },
    "provenance": {
      "type": "object",
      "description": "Optional L1 Provenance section (the Linear-types fundamental). Declares single-use Trithemius key capabilities (KeyCaps), linear provenance tokens (emitToken / mergeProvenance), and encoding ops (encodeSign / decodeSign) that lower to the runtime cipher. The L2 `ops` enum is unchanged — encodeSign/decodeSign are NOT accepted in `ops` (they live here). The compiler's L1 pass enforces linear token threading (one terminal token = the provenance root), a SYMBOL-modality check on encodeSign, and the KeyCap capability check (each key consumed exactly once). When absent, L1 is a no-op and the program lowers as before.",
      "additionalProperties": false,
      "required": ["keyCaps", "tokens", "ops"],
      "properties": {
        "keyCaps": {
          "type": "array",
          "description": "Trithemius key capability declarations. Each is single-use (consumed exactly once by one encodeSign/decodeSign op). `wheel` references a declared wheel; `alphabetSize` is the cipher alphabet (use 256 for byte-range signs).",
          "items": {
            "type": "object",
            "required": ["id", "wheel", "alphabetSize"],
            "additionalProperties": false,
            "properties": {
              "id": { "type": "string", "minLength": 1 },
              "wheel": { "type": "string", "minLength": 1, "description": "Referenced wheel node id." },
              "alphabetSize": { "type": "integer", "minimum": 1 }
            }
          }
        },
        "tokens": {
          "type": "array",
          "description": "Linear provenance tokens. `emitToken` anchors a token at an index; `mergeProvenance` joins input tokens into one merged lineage. Each token is consumed at most once (by a mergeProvenance input); exactly one token is the unconsumed terminal (the provenance root). Double-consumed or ambiguous-root tokens are L1 compile errors.",
          "items": {
            "type": "object",
            "required": ["id", "op"],
            "additionalProperties": false,
            "properties": {
              "id": { "type": "string", "minLength": 1 },
              "op": { "type": "string", "enum": ["emitToken", "mergeProvenance"] },
              "index": {
                "type": "integer",
                "minimum": 0,
                "description": "emitToken anchor index (required for emitToken)."
              },
              "inputs": {
                "type": "array",
                "minItems": 1,
                "items": { "type": "string", "minLength": 1 },
                "description": "mergeProvenance referenced token ids (required for mergeProvenance)."
              }
            }
          }
        },
        "ops": {
          "type": "array",
          "description": "Encoding lowering ops. `encodeSign` reads a SYMBOL-modality sign + consumes a KeyCap, producing an opaque EncToken (the Trithemius ciphertext). `decodeSign` reads an EncToken + consumes a KeyCap, producing a recovered Sign. `wheel` is accepted for signature fidelity to encodeSign(s,w,k); the cipher key state lives in the KeyCap's wheel. These are the L1 dialect ops — distinct from the L2 combinator `ops` array.",
          "items": {
            "type": "object",
            "required": ["id", "op", "wheel", "keyCap"],
            "additionalProperties": false,
            "properties": {
              "id": { "type": "string", "minLength": 1 },
              "op": { "type": "string", "enum": ["encodeSign", "decodeSign"] },
              "sign": {
                "type": "string",
                "minLength": 1,
                "description": "encodeSign: the sign node id to encode (must be SYMBOL-modality)."
              },
              "token": {
                "type": "string", "minLength": 1,
                "description": "decodeSign: the EncToken-producing op id to decode (an encodeSign op)."
              },
              "wheel": { "type": "string", "minLength": 1, "description": "Referenced wheel node id." },
              "keyCap": { "type": "string", "minLength": 1, "description": "Referenced KeyCap id (consumed)." }
            }
          }
        }
      }
    }
  }
}