{
  "$schema": "https://the-sovereign/ttcl-specs/semiotic-program-schema.json",
  "program": "triadic-observation",
  "wheels": [
    { "id": "wTheo", "size": 9, "initial": 0 }
  ],
  "signs": [
    {
      "id": "sTheo",
      "class_id": 8,
      "mode": "INDEX",
      "domain": "THEOLOGY",
      "modality": "SYMBOL",
      "pps": 0.30,
      "noRlhf": true
    },
    {
      "id": "sTech",
      "class_id": 2,
      "mode": "INDEX",
      "domain": "TECHNOLOGY",
      "modality": "INDEX",
      "pps": 0.50,
      "noRlhf": true
    },
    {
      "id": "sCosmo",
      "class_id": 42,
      "mode": "SYMBOL",
      "domain": "COSMOLOGY",
      "modality": "SYMBOL",
      "pps": 0.40,
      "noRlhf": true
    }
  ],
  "ops": [
    { "id": "oCompose", "op": "compose", "inputs": ["sTheo", "sTech", "sCosmo"] }
  ],
  "constitution": { "threshold": 0.72 },
  "budget": 1000,
  "output": "oCompose"
}